,Paper,Title,Supporting.Table,Column,Gene.Set.Size,Overlap,Odds,P.Value,Adj.P.Value
724,PMC8692249,Single-Cell Transcriptome Analysis Reveals RGS1 as a New Marker and Promoting Factor for T-Cell Exhaustion in Multiple Cancers,DataSheet_3.xlsx,HCC_Pre_DEG-Unnamed_0,289,32,3.72,1.61e-10,1.44e-7
725,PMC6433938,"The Association Between Vitamin D and Multiple Sclerosis Risk: 1,25(OH)2D3 Induces Super-Enhancers Bound by VDR",Table_1.XLSX,Genelist-ZMIZ1_gene_set,429,40,3.14,1.65e-10,1.47e-7
726,PMC9288051,Super-enhancer profiling identifies novel critical and targetable cancer survival gene LYL1 in pediatric acute myeloid leukemia,13046_2022_2428_MOESM4_ESM.xlsx,Super_enhancers_in_AML2-OVERLAP_GENES,393,38,3.25,1.69e-10,1.51e-7
727,PMC6330361,Quantitative Proteomics Reveals the Dynamic Protein Landscape during Initiation of Human Th17 Cell Polarization,mmc3.xlsx,Th0_vs_Thp_Common_Down-Proteins_detected_as_differentially_expressed_between_Th0_and_Thp_and_down-regulated_in_Th0_when_compared_to_Thp_at_both_24h_and_72h,768,57,2.50,1.73e-10,1.54e-7
728,PMC10582193,Single-cell chromatin accessibility and transcriptomic characterization of Behcet’s disease,42003_2023_5420_MOESM8_ESM.xlsx,DEGs_in_CD8_TEM-DEGs_in_CD8_TEM_between_BD_and_nonBD_groups_using_muscat,964,66,2.30,1.73e-10,1.54e-7
729,PMC9633226,A CD8+ T cell-associated immune gene panel for prediction of the prognosis and immunotherapeutic effect of melanoma,Table_1.xlsx,Sheet1-Table_S1_Differential_genes_in_CD8_T_cells_from_TISCH_SKCM_GSE120575,664,52,2.63,1.76e-10,1.56e-7
730,PMC8474495,Transcriptional profiling of macaque microglia reveals an evolutionary preserved gene expression program,mmc6.xlsx,Comparison-Unnamed_4,1335,82,2.07,1.79e-10,1.59e-7
731,PMC10559315,Epstein-Barr virus evades restrictive host chromatin closure by subverting B cell activation and germinal center regulatory loci,NIHMS1928283-supplement-3.xls,1242_Pre-PB_5_--DAP-linked_genes,412,39,3.18,1.80e-10,1.60e-7
732,PMC8521678,Single-cell profiling reveals the importance of CXCL13/CXCR5 axis biology in lymphocyte-rich classic Hodgkin lymphoma,pnas.2105822118.sd01.xlsx,all_clusters-Gene,1754,99,1.90,1.84e-10,1.63e-7
733,PMC7049906,Tissue alarmins and adaptive cytokine induce dynamic and distinct transcriptional responses in tissue-resident intraepithelial cytotoxic T lymphocytes,mmc16.xlsx,IFNB_Epi__-_NA-SYMBOL,1408,85,2.03,1.85e-10,1.63e-7
734,PMC8428985,An interactive single cell web portal identifies gene and cell networks in COVID-19 host responses,mmc6.xlsx,B_sub-cluster_modules-Table_S5c_Gene_modules_for_B_cell_sub-clusters_and_plasmablast_subtypes_with_200_most_significantly_upregulated_genes_in_each_module,1729,98,1.91,1.85e-10,1.63e-7
735,PMC7100912,A molecular network regulating the pro-inflammatory phenotype of human memory T lymphocytes,EMS85677-supplement-Suppl__Tables_1_8.xlsx,Table_8_A-Unnamed_17,1289,80,2.09,1.90e-10,1.68e-7
736,PMC7049906,Tissue alarmins and adaptive cytokine induce dynamic and distinct transcriptional responses in tissue-resident intraepithelial cytotoxic T lymphocytes,mmc16.xlsx,IFNB_Epi__-_NA-ENSEMBL,1409,85,2.03,1.91e-10,1.69e-7
737,PMC6750256,Profiling allele specific gene expression in brains from individuals with autism spectrum disorder reveals preferential minor allele usage,NIHMS1534152-supplement-7.xlsx,Gene_list-microglia,1806,101,1.88,1.92e-10,1.69e-7
738,PMC6817565,Transcriptome Analysis Identifies Piwi-Interacting RNAs as Prognostic Markers for Recurrence of Prostate Cancer,DataSheet_1.xlsx,supplementary_table_1-supplementary_table_1_Genes_in_brown_module,1934,106,1.84,1.92e-10,1.69e-7
739,PMC4942934,Whole-genome transcription and DNA methylation analysis of peripheral blood mononuclear cells identified aberrant gene regulation pathways in systemic lupus erythematosus,13075_2016_1050_MOESM2_ESM.xlsx,downreg_gene_NC_vs_SLE_LN--Data_Supplement_2-3,750,56,2.51,2.03e-10,1.78e-7
740,PMC7100912,A molecular network regulating the pro-inflammatory phenotype of human memory T lymphocytes,EMS85677-supplement-Suppl__Tables_1_8.xlsx,Table_8_A-Unnamed_18,1291,80,2.08,2.04e-10,1.79e-7
741,PMC9870087,Multicytokine-producing CD4+ T cells characterize the livers of patients with NASH,jciinsight-8-153831-s112.xlsx,DE_marker-Unnamed_7,414,39,3.17,2.08e-10,1.82e-7
742,PMC8233196,Functional and genomic adaptations of blood monocytes to pregravid obesity during pregnancy,mmc2.xlsx,Nonclassical_Mo-_cluster_II-Unnamed_0,1963,107,1.83,2.12e-10,1.85e-7
743,PMC6689091,PAK4 suppresses RELB to prevent senescence-like growth arrest in breast cancer,41467_2019_11510_MOESM8_ESM.xlsx,Sig_Up_Hs578T_-_NFkB-Gene_Name,969,66,2.29,2.15e-10,1.88e-7
744,PMC9174272,"Single-cell RNA-sequencing of peripheral blood mononuclear cells reveals widespread, context-specific gene expression regulation upon pathogenic exposure",41467_2022_30893_MOESM8_ESM.xlsx,CD4_Naive-Gene_symbol,1584,92,1.95,2.16e-10,1.89e-7
745,PMC8410602,BET proteolysis targeted chimera-based therapy of novel models of Richter Transformation-diffuse large B-cell lymphoma,41375_2021_1181_MOESM4_ESM.xlsx,HPRT3-Unnamed_7,2173,115,1.78,2.19e-10,1.91e-7
746,PMC10165782,Identification of potential resistance mechanisms and therapeutic targets for the relapse of BCMA CAR-T therapy in relapsed/refractory multiple myeloma through single-cell sequencing,40164_2023_402_MOESM7_ESM.csv,Unnamed_0,1486,88,1.99,2.20e-10,1.91e-7
747,PMC7417788,A human circulating immune cell landscape in aging and COVID-19,13238_2020_762_MOESM2_ESM.xls,Supplementary_Table_5B-Unnamed_1,903,63,2.35,2.21e-10,1.92e-7
748,PMC9806110,A novel molecular classification method for osteosarcoma based on tumor cell differentiation trajectories,41413_2022_233_MOESM13_ESM.xlsx,OS_vs_OB_findallmarker-Supplementary_Table_6_List_of_differentially_expressed_genes_DEGs_between_CSC-like_and_Osteoblast,1365,83,2.04,2.22e-10,1.92e-7
749,PMC9681209,Global hypo-methylation in a proportion of glioblastoma enriched for an astrocytic signature is associated with increased invasion and altered immune landscape,elife-77335-supp3.xlsx,NK_FGFBP2-gene,1341,82,2.06,2.22e-10,1.92e-7
750,PMC6675628,Childhood Cerebellar Tumors Mirror Conserved Fetal Transcriptional Programs,NIHMS1525286-supplement-Sup_Table_4.xlsx,PFA-1-gene,2494,127,1.71,2.23e-10,1.93e-7
751,PMC10551666,Dual Immune Checkpoint Blockade Induces Analogous Alterations in the Dysfunctional CD8+ T-cell and Activated Treg Compartment,cd-22-0851_supp8.xlsx,Table_S8-Unnamed_5,2121,113,1.79,2.23e-10,1.93e-7
752,PMC9439955,Histone acetylome-wide associations in immune cells from individuals with active Mycobacterium tuberculosis infection,41564_2021_1049_MOESM4_ESM.xlsx,SupTable33-Gene_Name,731,55,2.53,2.25e-10,1.94e-7
753,PMC9399107,scRNA-seq of gastric tumor shows complex intercellular interaction with an alternative T cell exhaustion trajectory,41467_2022_32627_MOESM6_ESM.xlsx,NK_NKT_and_γδT_subsets-gene_name_NKT_KLRC2,490,43,2.95,2.27e-10,1.95e-7
754,PMC9013654,Immune features of COVID-19 convalescent individuals revealed by a single-cell RNA sequencing,mmc5.xlsx,44-gene,1837,102,1.87,2.27e-10,1.95e-7
755,PMC10061014,Exploration of genotype-by-environment interactions affecting gene expression responses in porcine immune cells,Table5.XLSX,C_vs_LD-Table_S5c_Results_of_gene-wise_analysis_of_cd-ASE_depending_on_LPS_DEX,2148,114,1.78,2.28e-10,1.95e-7
756,PMC4580625,The Relationship of Immune Cell Signatures to Patient Survival Varies within and between Tumor Types,pone.0138726.s006.xlsx,Immune_molecular_modules-KIR2DL3_mod,93,18,6.51,2.28e-10,1.95e-7
757,PMC6718415,Heterogeneity of human bone marrow and blood natural killer cells defined by single-cell transcriptome,41467_2019_11947_MOESM6_ESM.xlsx,Supplementary_Data_2-Unnamed_0,588,48,2.75,2.32e-10,1.98e-7
758,PMC9675452,Fetal maturation revealed by amniotic fluid cell-free transcriptome in rhesus macaques,jciinsight-7-162101-s237.xlsx,DEGs-Rh_AF_Term-v-Pre_Up,1711,97,1.91,2.32e-10,1.99e-7
759,PMC4952232,Identification of baseline gene expression signatures predicting therapeutic responses to three biologic agents in rheumatoid arthritis: a retrospective observational study,13075_2016_1052_MOESM2_ESM.xlsx,Additional_file_1-Unnamed_13,82,17,6.97,2.33e-10,1.99e-7
760,PMC6667500,A protein-RNA interaction atlas of the ribosome biogenesis factor AATF,41598_2019_47552_MOESM2_ESM.xlsx,B_496_02-ID,2388,123,1.73,2.34e-10,1.99e-7
761,PMC9562361,Single cell analysis of cribriform prostate cancer reveals cell intrinsic and tumor microenvironmental pathways of aggressive disease,41467_2022_33780_MOESM3_ESM.xlsx,Table_S41-Table_S41,1415,85,2.02,2.36e-10,2.01e-7
762,PMC8900158,"Transcriptome Profiling of Porcine Naïve, Intermediate and Terminally Differentiated CD8+ T Cells",Table_1.xlsx,S1_DEGs_ex_vivo_CTL_subsets-Naive_vs_Terminally,1154,74,2.16,2.38e-10,2.03e-7
763,PMC7961017,Circulating mucosal-associated invariant T cells identify patients responding to anti-PD-1 therapy,41467_2021_21928_MOESM4_ESM.xlsx,CYTOTOXIC_FIGURE_2-GeneSymbol,362,36,3.34,2.38e-10,2.03e-7
764,PMC6948000,Replication and expansion of epigenome-wide association literature in a black South African population,13148_2019_805_MOESM1_ESM.xlsx,b_smoking-Unnamed_3,1712,97,1.91,2.39e-10,2.03e-7
765,PMC10352330,Context-defined cancer co-dependency mapping identifies a functional interplay between PRC2 and MLL-MEN1 complex in lymphoma,41467_2023_39990_MOESM6_ESM.xlsx,Fig_S7d-Unnamed_12,2046,110,1.81,2.46e-10,2.08e-7
766,PMC9849137,Uncovering the mode of action of engineered T cells in patient cancer organoids,41587_2022_1397_MOESM8_ESM.xlsx,DEG_Azizi-gene,1225,77,2.11,2.46e-10,2.08e-7
767,PMC9473489,The combination of DNA methylome and transcriptome revealed the intergenerational inheritance on the influence of advanced maternal age,CTM2-12-e990-s010.xlsx,five_down_DEGs_list-Unnamed_2,1465,87,2.00,2.47e-10,2.09e-7
768,PMC6687507,A Human Liver Cell Atlas reveals Heterogeneity and Epithelial Progenitors,EMS83302-supplement-Suppl_Data_Table_1.xls,Cluster_14-GeneSymbol,2418,124,1.72,2.54e-10,2.14e-7
769,PMC5067504,Interactome-transcriptome analysis discovers signatures complementary to GWAS Loci of Type 2 Diabetes,srep35228-s3.xls,T2D_Interactome_signatures-T2D_interactome_signatures_and_differential_gene_expression_in_our_discovery_cohort,417,39,3.15,2.57e-10,2.17e-7
770,PMC4333391,Regulation of the transcriptional program by DNA methylation during human αβ T-cell development,supp_gku1340_nar-00947-x-2014-File009.xls,Step_4b-SYMBOL,713,54,2.55,2.62e-10,2.20e-7
771,PMC9127271,N1-Methyladenosine (m1A) Regulation Associated With the Pathogenesis of Abdominal Aortic Aneurysm Through YTHDF3 Modulating Macrophage Polarization,Table_2.xlsx,sheet1-Gene,2153,114,1.78,2.62e-10,2.20e-7
772,PMC9356015,Altered gene expression profiles impair the nervous system development in individuals with 15q13.3 microdeletion,41598_2022_17604_MOESM2_ESM.xlsx,DE_individuals-Ensemble_ID,2206,116,1.77,2.64e-10,2.22e-7
773,PMC9013654,Immune features of COVID-19 convalescent individuals revealed by a single-cell RNA sequencing,mmc5.xlsx,27-gene,863,61,2.38,2.64e-10,2.22e-7
774,PMC5390115,A Genome-wide Analysis of Human Pluripotent Stem Cell-Derived Endothelial Cells in 2D or 3D Culture,mmc7.xlsx,DE_Lists-Unnamed_20,1467,87,1.99,2.65e-10,2.22e-7
775,PMC7321885,Intratumoral CD4+ T Cells Mediate Anti-tumor Cytotoxicity in Human Bladder Cancer,mmc2.xlsx,CD8XCL-names,974,66,2.28,2.67e-10,2.24e-7
776,PMC4924651,Comparative analysis of human and mouse transcriptomes of Th17 cell priming,oncotarget-07-13416-s003.xlsx,ALL_lncRNA_human-Unnamed_33,2049,110,1.81,2.68e-10,2.24e-7
777,PMC10576058,Dissecting the pathogenic effects of smoking and its hallmarks in blood DNA methylation on colorectal cancer risk,41416_2023_2397_MOESM1_ESM.xlsx,Table_S2-Unnamed_3,1204,76,2.12,2.70e-10,2.26e-7
778,PMC8989655,Type I Interferon Transcriptional Network Regulates Expression of Coinhibitory Receptors in Human T cells,NIHMS1777806-supplement-Source_Data_Fig__2.xlsx,Figure_2a-Unnamed_10,1691,96,1.91,2.73e-10,2.28e-7
779,PMC7986389,Weighted minimum feedback vertex sets and implementation in human cancer genes detection,12859_2021_4062_MOESM3_ESM.txt,node1_name,2448,125,1.72,2.75e-10,2.29e-7
780,PMC7986389,Weighted minimum feedback vertex sets and implementation in human cancer genes detection,12859_2021_4062_MOESM3_ESM.txt,node2_name,2448,125,1.72,2.75e-10,2.29e-7
781,PMC9174272,"Single-cell RNA-sequencing of peripheral blood mononuclear cells reveals widespread, context-specific gene expression regulation upon pathogenic exposure",41467_2022_30893_MOESM8_ESM.xlsx,CD8_Naive-Gene_symbol,2155,114,1.78,2.77e-10,2.30e-7
782,PMC7831653,Neurological Manifestations of COVID-19 Feature T Cell Exhaustion and Dedifferentiated Monocytes in Cerebrospinal Fluid,mmc3.xlsx,DE_mono2_vs_mono1_and_mono3-gene,2422,124,1.72,2.82e-10,2.34e-7
783,PMC9323019,Regionally distinct trophoblast regulate barrier function and invasion in the human placenta,elife-78829-fig1-data1.csv,gene,2449,125,1.72,2.82e-10,2.34e-7
784,PMC7569686,Peripheral Blood RNA Sequencing Unravels a Differential Signature of Coding and Noncoding Genes by Types of Kidney Allograft Rejection,mmc5.xlsx,SuppTableS2-gene,1066,70,2.21,2.82e-10,2.34e-7
785,PMC4349985,Mass Spectrometry of Human Leukocyte Antigen Class I Peptidomes Reveals Strong Effects of Protein Abundance and Turnover on Antigen Presentation,supp_M114.042812_mcp.M114.042812,5.xlsx-peptide_intensity_JY-Ensembl_ID,2156,114,1.78,2.85e-10,2.35e-7
786,PMC9356015,Altered gene expression profiles impair the nervous system development in individuals with 15q13.3 microdeletion,41598_2022_17604_MOESM2_ESM.xlsx,DE_individuals-symbol,2209,116,1.77,2.86e-10,2.36e-7
787,PMC8987207,Monoallelic Heb/Tcf12 Deletion Reduces the Requirement for NOTCH1 Hyperactivation in T-Cell Acute Lymphoblastic Leukemia,DataSheet_1.xls,TF_targets_Fig_2A-HEB_CCRFCEM_ChIP-seq,2451,125,1.72,2.97e-10,2.45e-7
788,PMC7212672,Sampling time-dependent artifacts in single-cell genomics studies,13059_2020_2032_MOESM2_ESM.xlsx,PBMC-Differentially_expressed_genes_in_prolonged_2_h_storage_of_PBMC_samples,1160,74,2.15,3.01e-10,2.48e-7
789,PMC10559315,Epstein-Barr virus evades restrictive host chromatin closure by subverting B cell activation and germinal center regulatory loci,NIHMS1928283-supplement-3.xls,1241_Hyperprolif_6-DAP-linked_genes,1398,84,2.02,3.04e-10,2.50e-7
790,PMC6886578,Histone hyperacetylation disrupts core gene regulatory architecture in rhabdomyosarcoma,NIHMS1541485-supplement-3.xlsx,SuppTable2-GeneSets-Unnamed_8,553,46,2.80,3.05e-10,2.50e-7
791,PMC9767677,Mapping single-cell transcriptomes in the intra-tumoral and associated territories of kidney cancer,mmc5.xlsx,CD8-gene,553,46,2.80,3.05e-10,2.50e-7
792,PMC5063315,Induced Human Decidual NK-Like Cells Improve Utero-Placental Perfusion in Mice,pone.0164353.s004.xlsx,pNKCD56Dimvs_dNK_and_idNK_CD56D-Gene_Symbol,696,53,2.56,3.20e-10,2.62e-7
793,PMC8386078,Acute depletion of CTCF rewires genome-wide chromatin accessibility,13059_2021_2466_MOESM5_ESM.xlsx,InsulatorTargets-Unnamed_20,2108,112,1.79,3.24e-10,2.65e-7
794,PMC7721881,Improving the informativeness of Mendelian disease-derived pathogenicity scores for common disease,41467_2020_20087_MOESM11_ESM.xlsx,Supplementary_Data_8B-MohammadiVg_SKINS,1400,84,2.02,3.26e-10,2.66e-7
795,PMC6689091,PAK4 suppresses RELB to prevent senescence-like growth arrest in breast cancer,41467_2019_11510_MOESM8_ESM.xlsx,Significant_Hs578T_-_NFkB-Gene_Name,2161,114,1.77,3.27e-10,2.67e-7
796,PMC7906381,Deciphering microRNA-mRNA regulatory network in adult T-cell leukemia/lymphoma; the battle between oncogenes and anti-oncogenes,pone.0247713.s001.xlsx,DEGs-Unnamed_0,2109,112,1.79,3.33e-10,2.71e-7
797,PMC4952232,Identification of baseline gene expression signatures predicting therapeutic responses to three biologic agents in rheumatoid arthritis: a retrospective observational study,13075_2016_1052_MOESM2_ESM.xlsx,Additional_file_1-Unnamed_4,63,15,8.01,3.37e-10,2.74e-7
798,PMC2680378,A HaemAtlas: characterizing gene expression in differentiated human blood cells,blood-2008-06-162958_TableS5.xls,specific-CD56-External_Gene_ID,63,15,8.01,3.37e-10,2.74e-7
799,PMC9800255,Depletion of HIV reservoir by activation of ISR signaling in resting CD4+ T cells,mmc2.xlsx,Cluster3-gene,1163,74,2.14,3.38e-10,2.74e-7
800,PMC9338059,KOPI: Kinase inhibitOr Proteome Impact analysis,41598_2022_16557_MOESM6_ESM.xlsx,PhosphoResponseInProtein-geneName,1825,101,1.86,3.42e-10,2.78e-7
801,PMC8093261,Single-cell profiling reveals the trajectories of natural killer cell differentiation in bone marrow and a stress signature induced by acute myeloid leukemia,41423_2020_574_MOESM9_ESM.xlsx,Table_1E-Unnamed_0,84,17,6.81,3.47e-10,2.81e-7
802,PMC9716034,Immune mechanism of low bone mineral density caused by ankylosing spondylitis based on bioinformatics and machine learning,Table2.XLSX,AS-related_DEGs,2006,108,1.81,3.48e-10,2.81e-7
803,PMC4487811,Identification of a Dynamic Core Transcriptional Network in t(8;21) AML that Regulates Differentiation Block and Self-Renewal,mmc2.xlsx,siMM_enriched_geneLists-Occupancy_pattern_genes_lists_that_are_enriched_with_up_down_regulated_genes,332,34,3.44,3.51e-10,2.84e-7
804,PMC9338059,KOPI: Kinase inhibitOr Proteome Impact analysis,41598_2022_16557_MOESM5_ESM.xlsx,PhosphoResponse37C-geneName,1826,101,1.86,3.53e-10,2.85e-7
805,PMC9288051,Super-enhancer profiling identifies novel critical and targetable cancer survival gene LYL1 in pediatric acute myeloid leukemia,13046_2022_2428_MOESM4_ESM.xlsx,Super_enhancers_in_AML7-OVERLAP_GENES,249,29,3.92,3.58e-10,2.88e-7
806,PMC7050134,Epigenome-wide meta-analysis of blood DNA methylation in newborns and children identifies numerous loci related to gestational age,13073_2020_716_MOESM1_ESM.xlsx,Table_S16-Unnamed_3,2297,119,1.74,3.58e-10,2.88e-7
807,PMC9281170,Detection of cell markers from single cell RNA-seq with sc2marker,12859_2022_4817_MOESM4_ESM.xlsx,ROC_mono-Unnamed_0,1853,102,1.85,3.68e-10,2.94e-7
808,PMC9281170,Detection of cell markers from single cell RNA-seq with sc2marker,12859_2022_4817_MOESM4_ESM.xlsx,Ttest_mono-Unnamed_0,1853,102,1.85,3.68e-10,2.94e-7
809,PMC9281170,Detection of cell markers from single cell RNA-seq with sc2marker,12859_2022_4817_MOESM4_ESM.xlsx,Wilcox_mono-Unnamed_0,1853,102,1.85,3.68e-10,2.94e-7
810,PMC9281170,Detection of cell markers from single cell RNA-seq with sc2marker,12859_2022_4817_MOESM4_ESM.xlsx,LR_mono-Unnamed_0,1853,102,1.85,3.68e-10,2.94e-7
811,PMC9281170,Detection of cell markers from single cell RNA-seq with sc2marker,12859_2022_4817_MOESM4_ESM.xlsx,MAST_mono-Unnamed_0,1853,102,1.85,3.68e-10,2.94e-7
812,PMC7931910,The Human Blood Transcriptome in a Large Population Cohort and Its Relation to Aging and Health,Data_Sheet_3.xlsx,H-Symbol,203,26,4.31,3.74e-10,2.99e-7
813,PMC7854640,Tumour heterogeneity and intercellular networks of nasopharyngeal carcinoma at single cell resolution,41467_2021_21043_MOESM8_ESM.xlsx,Supplementary_Data_5-Unnamed_1,2460,125,1.71,3.76e-10,3.00e-7
814,PMC9971904,Single-cell RNA-seq analysis reveals dual sensing of HIV-1 in blood Axl+ dendritic cells,mmc2.xlsx,AxlDC_AD8vpx_vs_AxlDC_mock-gene_name,1931,105,1.83,3.77e-10,3.00e-7
815,PMC7417788,A human circulating immune cell landscape in aging and COVID-19,13238_2020_762_MOESM2_ESM.xls,Supplementary_Table_13C-Unnamed_1,915,63,2.32,3.77e-10,3.00e-7
816,PMC9509601,Intratumor heterogeneity and T cell exhaustion in primary CNS lymphoma,13073_2022_1110_MOESM12_ESM.xlsx,Sheet1-gene,1453,86,1.99,3.78e-10,3.01e-7
817,PMC2743717,Weighted gene co-expression network analysis of the peripheral blood from Amyotrophic Lateral Sclerosis patients,1471-2164-10-405-S1.xls,Top_2300-Gene_Symbol,2009,108,1.81,3.79e-10,3.01e-7
818,PMC7611047,Peripheral CD8+ T cell characteristics associated with durable responses to immune checkpoint blockade in patients with metastatic melanoma,EMS85150-supplement-Supplementary_tables.xlsx,Table_9_large_clone_genes-gene,234,28,4.02,3.87e-10,3.07e-7
819,PMC9509601,Intratumor heterogeneity and T cell exhaustion in primary CNS lymphoma,13073_2022_1110_MOESM6_ESM.xlsx,Tc-gene,1261,78,2.08,3.90e-10,3.09e-7
820,PMC8728943,Integrative blood-derived epigenetic and transcriptomic analysis reveals the potential regulatory role of DNA methylation in ankylosing spondylitis,13075_2021_2697_MOESM3_ESM.xlsx,supplementary_data_S1-Unnamed_10,2010,108,1.81,3.90e-10,3.09e-7
821,PMC4580625,The Relationship of Immune Cell Signatures to Patient Survival Varies within and between Tumor Types,pone.0138726.s006.xlsx,Immune_molecular_modules-XCL2_mod,96,18,6.31,3.94e-10,3.11e-7
822,PMC4580625,The Relationship of Immune Cell Signatures to Patient Survival Varies within and between Tumor Types,pone.0138726.s006.xlsx,Immune_molecular_modules-NCR1_mod,96,18,6.31,3.94e-10,3.11e-7
823,PMC6787028,N6-methyladenosine mRNA marking promotes selective translation of regulons required for human erythropoiesis,41467_2019_12518_MOESM5_ESM.xlsx,CD14-gencode_v19_KNOWN,850,60,2.37,3.96e-10,3.12e-7
824,PMC9391397,Vasculogenesis in kidney organoids upon transplantation,41536_2022_237_MOESM9_ESM.xlsx,Endothelial_cells-gene,1703,96,1.90,3.98e-10,3.13e-7
825,PMC9546237,Whole blood transcriptomic profiling identifies molecular pathways related to cardiovascular mortality in heart failure,EJHF-24-1009-s001.xlsx,Supplemental_Table_1-ENSG_FC_5,1144,73,2.15,3.99e-10,3.14e-7
826,PMC4487811,Identification of a Dynamic Core Transcriptional Network in t(8;21) AML that Regulates Differentiation Block and Self-Renewal,mmc3.xlsx,siRE_enriched_geneLists-Unnamed_15,2011,108,1.81,4.01e-10,3.15e-7
827,PMC6884554,Predicting novel genomic regions linked to genetic disorders using GWAS and chromosome conformation data – a case study of schizophrenia,41598_2019_54514_MOESM2_ESM.xlsx,cluster1-Gene_symbol,2463,125,1.71,4.06e-10,3.18e-7
828,PMC2838864,SplicerAV: a tool for mining microarray expression data for changes in RNA processing,1471-2105-11-108-S2.TXT,Unnamed_1,1934,105,1.83,4.12e-10,3.22e-7
829,PMC7926219,Long non‐coding RNA TINCR suppresses metastatic melanoma dissemination by preventing ATF4 translation,EMBR-22-e50852-s008.xlsx,Dataset_EV6-Dataset_EV6_Significantly_enriched_mRNAs_in_TINCR_RIA-seq_Related_to_Figure_6_and_Appendix_Figures_S3_S4_S5,2038,109,1.80,4.12e-10,3.23e-7
830,PMC9546237,Whole blood transcriptomic profiling identifies molecular pathways related to cardiovascular mortality in heart failure,EJHF-24-1009-s001.xlsx,Supplemental_Table_1-Symbol_1153,1145,73,2.14,4.15e-10,3.24e-7
831,PMC7458795,Effects of Cryopreservation and Thawing on Single-Cell Transcriptomes of Human T Cells,in-20-e34-s001.xls,By_wilcox-Supplementary_Table_1_Marker_genes_for_each_cluster_from_the_fresh_sample,1263,78,2.08,4.19e-10,3.27e-7
832,PMC4196925,Copy Number Loss of the Interferon Gene Cluster in Melanomas Is Linked to Reduced T Cell Infiltrate and Poor Patient Prognosis,pone.0109760.s005.xlsx,Supp_Table_1_Genes_in_immune_mo-GZMB_mod,85,17,6.73,4.22e-10,3.29e-7
833,PMC9126928,Single-cell transcriptomics reveals lineage trajectory of human scalp hair follicle and informs mechanisms of hair graying,41421_2022_394_MOESM8_ESM.xlsx,SC1-Age_Differentially_Expressed_Genes_DEGs_of_HFs_were_Identified_by_Function_FindMarkers_of_Seurat_R_Package_Using_Wilcox_Method_log2FC_0_05_pct_0_2,2492,126,1.70,4.26e-10,3.32e-7
834,PMC8787220,The Crosstalk Between Malignant Cells and Tumor-Promoting Immune Cells Relevant to Immunotherapy in Pancreatic Ductal Adenocarcinoma,Table3.XLSX,SC-CD8feature-feature,539,45,2.81,4.27e-10,3.32e-7
835,PMC8809252,Spatial proteogenomics reveals distinct and evolutionarily conserved hepatic macrophage niches,mmc1.xlsx,Human_Circ_NK_NKT_cell_DEGs-Unnamed_0,64,15,7.88,4.29e-10,3.33e-7
836,PMC4617899,BubbleGUM: automatic extraction of phenotype molecular signatures and comprehensive visualization of multiple Gene Set Enrichment Analyses,12864_2015_2012_MOESM2_ESM.xlsx,NK_SIG_mean_2x-Unnamed_1,744,55,2.49,4.31e-10,3.34e-7
837,PMC9013654,Immune features of COVID-19 convalescent individuals revealed by a single-cell RNA sequencing,mmc5.xlsx,25-gene,481,42,2.94,4.33e-10,3.35e-7
838,PMC8546983,Systems Biology behind Immunoprotection of Both Sheep and Goats after Sungri/96 PPRV Vaccination,msystems.00820,20-sd001.xls-CD4_OA-Genes,1457,86,1.99,4.33e-10,3.35e-7
839,PMC4333391,Regulation of the transcriptional program by DNA methylation during human αβ T-cell development,supp_gku1340_nar-00947-x-2014-File012.xls,STEP4a-SYMBOL,1384,83,2.02,4.34e-10,3.36e-7
840,PMC9804143,Osteopontin associates with brain TRM-cell transcriptome and compartmentalization in donors with and without multiple sclerosis,mmc2.xlsx,WM_CD8_TRM_vs_GM_CD8_TRM-original,2199,115,1.76,4.50e-10,3.47e-7
841,PMC9804143,Osteopontin associates with brain TRM-cell transcriptome and compartmentalization in donors with and without multiple sclerosis,mmc2.xlsx,WM_CD8_TRM_vs_GM_CD8_TRM-ensembl_gene_id,2199,115,1.76,4.50e-10,3.47e-7
842,PMC7738879,Phosphoproteomics identify arachidonic-acid-regulated signal transduction pathways modulating macrophage functions with implications for ovarian cancer,thnov11p1377s2.xlsx,S3-Gene_names,2440,124,1.71,4.50e-10,3.47e-7
843,PMC3426530,Ago HITS-CLIP Expands Understanding of Kaposi's Sarcoma-associated Herpesvirus miRNA Function in Primary Effusion Lymphomas,ppat.1002884.s014.xlsx,A_BCBL-1_2of3-Supplementary_Table_S3A,2307,119,1.73,4.68e-10,3.60e-7
844,PMC4580625,The Relationship of Immune Cell Signatures to Patient Survival Varies within and between Tumor Types,pone.0138726.s006.xlsx,Immune_molecular_modules-CD7_mod,97,18,6.24,4.70e-10,3.62e-7
845,PMC9122264,Multimodal profiling of lung granulomas in macaques reveals cellular correlates of tuberculosis control,mmc3.xlsx,Fibroblasts-Gene_ID,1196,75,2.11,4.86e-10,3.73e-7
